{
  "$schema": "https://json-schema.org/draft/2020-12/schema",
  "dataset": "LLM API list prices, corrected for prompt caching and batch tiers",
  "publisher": "rabayid.com",
  "homepage": "https://rabayid.com/",
  "human_page": "https://rabayid.com/",
  "machine_page": "https://rabayid.com/data/pricing.json",
  "prices_verified": "October 2026",
  "generated": "2026-10-10",
  "currency": "USD",
  "unit": "per 1,000,000 tokens",
  "model_count": 28,
  "providers": [
    "Anthropic",
    "DeepSeek",
    "Google",
    "OpenAI",
    "xAI"
  ],
  "provider_pricing_urls": {
    "Anthropic": "https://platform.claude.com/docs/en/about-claude/pricing",
    "DeepSeek": "https://api-docs.deepseek.com/quick_start/pricing",
    "Google": "https://ai.google.dev/gemini-api/docs/pricing",
    "OpenAI": "https://platform.openai.com/docs/pricing",
    "xAI": "https://docs.x.ai/docs/models"
  },
  "field_notes": {
    "input": "Price for input tokens that were not served from cache.",
    "cached_input": "Price for input tokens read from a warm prompt cache. Cheapest billed input class.",
    "cache_write": "Price for writing tokens into cache. Carries a premium on Anthropic. Not published by Google, which bills cached-context storage per MTok-hour instead.",
    "output": "Price for generated tokens, including reasoning tokens where the provider bills them as output.",
    "supports_batch_api_false": "Provider publishes no batch tier. Such models are excluded from batch rankings rather than shown at zero cost.",
    "long_context_tier": "Providers switch to these rates once input exceeds the threshold. Quoting a single flat rate is misleading for large prompts."
  },
  "accuracy_note": "Transcribed from each provider's own published pricing page. Rates change often and several are promotional. Always confirm against the provider before committing to a contract.",
  "models": [
    {
      "id": "gpt-6-astra",
      "name": "GPT-6 Astra",
      "provider": "OpenAI",
      "context_window_tokens": 1050000,
      "usd_per_million_tokens": {
        "input": 10,
        "cached_input": 1,
        "cache_write": 12.5,
        "output": 50
      },
      "supports_batch_api": true,
      "promotional": false,
      "flagship": true,
      "long_context_tier": {
        "threshold_tokens": 272000,
        "usd_per_million_tokens": {
          "input": 20,
          "cached_input": 2,
          "cache_write": 25,
          "output": 75
        }
      },
      "note": "Flagship. Released Sep 2026.",
      "pricing_url": "https://platform.openai.com/docs/pricing"
    },
    {
      "id": "gpt-6.1-sol",
      "name": "GPT-6.1 Sol",
      "provider": "OpenAI",
      "context_window_tokens": 1050000,
      "usd_per_million_tokens": {
        "input": 2,
        "cached_input": 0.1,
        "cache_write": 2.5,
        "output": 10
      },
      "supports_batch_api": true,
      "promotional": false,
      "flagship": true,
      "long_context_tier": {
        "threshold_tokens": 272000,
        "usd_per_million_tokens": {
          "input": 4,
          "cached_input": 0.2,
          "cache_write": 5,
          "output": 15
        }
      },
      "note": "Cached input at 5% of base rate, half the GPT-6 Sol rate.",
      "pricing_url": "https://platform.openai.com/docs/pricing"
    },
    {
      "id": "gpt-6-sol",
      "name": "GPT-6 Sol",
      "provider": "OpenAI",
      "context_window_tokens": 1050000,
      "usd_per_million_tokens": {
        "input": 2,
        "cached_input": 0.2,
        "cache_write": 2.5,
        "output": 10
      },
      "supports_batch_api": true,
      "promotional": false,
      "flagship": true,
      "long_context_tier": {
        "threshold_tokens": 272000,
        "usd_per_million_tokens": {
          "input": 4,
          "cached_input": 0.4,
          "cache_write": 5,
          "output": 15
        }
      },
      "note": "Mid tier of the GPT-6 family.",
      "pricing_url": "https://platform.openai.com/docs/pricing"
    },
    {
      "id": "gpt-6-luna",
      "name": "GPT-6 Luna",
      "provider": "OpenAI",
      "context_window_tokens": 1050000,
      "usd_per_million_tokens": {
        "input": 0.1,
        "cached_input": 0.01,
        "cache_write": 0.125,
        "output": 0.5
      },
      "supports_batch_api": true,
      "promotional": false,
      "long_context_tier": {
        "threshold_tokens": 272000,
        "usd_per_million_tokens": {
          "input": 0.2,
          "cached_input": 0.02,
          "cache_write": 0.25,
          "output": 0.75
        }
      },
      "note": "Budget tier. Classification, routing, extraction.",
      "pricing_url": "https://platform.openai.com/docs/pricing"
    },
    {
      "id": "gpt-5.6-sol",
      "name": "GPT-5.6 Sol",
      "provider": "OpenAI",
      "context_window_tokens": 1050000,
      "usd_per_million_tokens": {
        "input": 4,
        "cached_input": 0.4,
        "cache_write": 5,
        "output": 20
      },
      "supports_batch_api": true,
      "promotional": true,
      "promotion_ends": "Nov 21, 2026",
      "flagship": true,
      "long_context_tier": {
        "threshold_tokens": 272000,
        "usd_per_million_tokens": {
          "input": 8,
          "cached_input": 0.8,
          "cache_write": 10,
          "output": 30
        }
      },
      "note": "Promotional rate, holds at least through Nov 21, 2026 (was $5/$30).",
      "pricing_url": "https://platform.openai.com/docs/pricing"
    },
    {
      "id": "gpt-5.6-terra",
      "name": "GPT-5.6 Terra",
      "provider": "OpenAI",
      "context_window_tokens": 1050000,
      "usd_per_million_tokens": {
        "input": 2,
        "cached_input": 0.2,
        "cache_write": 2.5,
        "output": 12
      },
      "supports_batch_api": true,
      "promotional": false,
      "flagship": true,
      "long_context_tier": {
        "threshold_tokens": 272000,
        "usd_per_million_tokens": {
          "input": 4,
          "cached_input": 0.4,
          "cache_write": 5,
          "output": 18
        }
      },
      "note": "Default workhorse. Price cut Jul 30, 2026.",
      "pricing_url": "https://platform.openai.com/docs/pricing"
    },
    {
      "id": "gpt-5.6-luna",
      "name": "GPT-5.6 Luna",
      "provider": "OpenAI",
      "context_window_tokens": 1050000,
      "usd_per_million_tokens": {
        "input": 0.2,
        "cached_input": 0.02,
        "cache_write": 0.25,
        "output": 1.2
      },
      "supports_batch_api": true,
      "promotional": false,
      "long_context_tier": {
        "threshold_tokens": 272000,
        "usd_per_million_tokens": {
          "input": 0.4,
          "cached_input": 0.04,
          "cache_write": 0.5,
          "output": 1.8
        }
      },
      "note": "Budget tier of the 5.6 family, sold alongside GPT-6 Luna.",
      "pricing_url": "https://platform.openai.com/docs/pricing"
    },
    {
      "id": "gpt-5.5",
      "name": "GPT-5.5",
      "provider": "OpenAI",
      "context_window_tokens": 1050000,
      "usd_per_million_tokens": {
        "input": 5,
        "cached_input": 0.5,
        "cache_write": null,
        "output": 30
      },
      "supports_batch_api": true,
      "promotional": false,
      "flagship": true,
      "long_context_tier": {
        "threshold_tokens": 272000,
        "usd_per_million_tokens": {
          "input": 10,
          "cached_input": 1,
          "cache_write": null,
          "output": 45
        }
      },
      "note": "Previous flagship.",
      "pricing_url": "https://platform.openai.com/docs/pricing"
    },
    {
      "id": "gpt-5.4",
      "name": "GPT-5.4",
      "provider": "OpenAI",
      "context_window_tokens": 1050000,
      "usd_per_million_tokens": {
        "input": 2.5,
        "cached_input": 0.25,
        "cache_write": null,
        "output": 15
      },
      "supports_batch_api": true,
      "promotional": false,
      "long_context_tier": {
        "threshold_tokens": 272000,
        "usd_per_million_tokens": {
          "input": 5,
          "cached_input": 0.5,
          "cache_write": null,
          "output": 22.5
        }
      },
      "note": "Superseded by Terra.",
      "pricing_url": "https://platform.openai.com/docs/pricing"
    },
    {
      "id": "gpt-5.4-mini",
      "name": "GPT-5.4 mini",
      "provider": "OpenAI",
      "context_window_tokens": 400000,
      "usd_per_million_tokens": {
        "input": 0.75,
        "cached_input": 0.075,
        "cache_write": null,
        "output": 4.5
      },
      "supports_batch_api": true,
      "promotional": false,
      "note": "Lightweight tier.",
      "pricing_url": "https://platform.openai.com/docs/pricing"
    },
    {
      "id": "gpt-5.4-nano",
      "name": "GPT-5.4 nano",
      "provider": "OpenAI",
      "context_window_tokens": 400000,
      "usd_per_million_tokens": {
        "input": 0.2,
        "cached_input": 0.02,
        "cache_write": null,
        "output": 1.25
      },
      "supports_batch_api": true,
      "promotional": false,
      "note": "Cheapest GPT tier.",
      "pricing_url": "https://platform.openai.com/docs/pricing"
    },
    {
      "id": "gpt-5.2",
      "name": "GPT-5.2",
      "provider": "OpenAI",
      "context_window_tokens": 400000,
      "usd_per_million_tokens": {
        "input": 1.75,
        "cached_input": 0.175,
        "cache_write": null,
        "output": 14
      },
      "supports_batch_api": true,
      "promotional": false,
      "pricing_url": "https://platform.openai.com/docs/pricing"
    },
    {
      "id": "gpt-4.1",
      "name": "GPT-4.1",
      "provider": "OpenAI",
      "context_window_tokens": 1047576,
      "usd_per_million_tokens": {
        "input": 2,
        "cached_input": 0.5,
        "cache_write": null,
        "output": 8
      },
      "supports_batch_api": true,
      "promotional": false,
      "note": "Still widely deployed.",